{
  "id": "BM_PARTNERRESIDENCE_GOVBM_2026",
  "country": "Bermuda",
  "visa_name": "Partner Residence",
  "route": "Partner Residence application (Department of Immigration)",
  "authority": "Government of Bermuda, Department of Immigration",
  "last_verified": "2026-06-16",
  "sources": [
    {
      "source_id": "BM_PARTNERRESIDENCE_GOVBM_2026",
      "url": "https://www.gov.bm/sites/default/files/2025-09/Partner-Residence-Application-Guidelines.pdf",
      "retrieved_at": "2026-06-16T00:00:00Z",
      "sha256": "3a08b313a28d23701681dd1c2aab744197debb578046e56e3cb49df6d964eab1",
      "local_path": "sources/BM_PARTNERRESIDENCE_GOVBM_2026-06-16.pdf"
    }
  ],
  "requirements": [
    {
      "key": "insurance.mandatory",
      "op": "==",
      "value": true,
      "evidence": [
        {
          "source_id": "BM_PARTNERRESIDENCE_GOVBM_2026",
          "locator": "General Rules and Criteria, Health Insurance",
          "excerpt": "Applicants must have private health insurance coverage for the duration of their intended stay in Bermuda."
        }
      ]
    },
    {
      "key": "insurance.must_cover_full_period",
      "op": "==",
      "value": true,
      "evidence": [
        {
          "source_id": "BM_PARTNERRESIDENCE_GOVBM_2026",
          "locator": "General Rules and Criteria, Health Insurance",
          "excerpt": "Applicants must have private health insurance coverage for the duration of their intended stay in Bermuda."
        }
      ]
    }
  ]
}
