{
  "id": "BR_DNV_LISBOA_2026",
  "country": "Brazil",
  "visa_name": "Digital Nomad Visa (VITEM XIV)",
  "route": "Visto Temporario XIV (gov.br Lisboa)",
  "authority": "Ministerio das Relacoes Exteriores, Consulado-Geral do Brasil em Lisboa (gov.br)",
  "last_verified": "2026-06-13",
  "sources": [
    {
      "source_id": "BR_DNV_LISBOA_2026",
      "url": "https://www.gov.br/mre/pt-br/consulado-lisboa/servicos-consulares/vistos-destinados-a-estrangeiros-para-entrada-no-brasil/visto-temporario-xiv-2013-nomade-digital-vitem-xiv",
      "retrieved_at": "2026-06-13T00:00:00Z",
      "sha256": "7adb15bbf5c8ef7504b0b6c78c6968a3a12ef0d58013cba8e2002ef28ef5664a",
      "local_path": "sources/BR_DNV_LISBOA_2026-06-13.html"
    }
  ],
  "requirements": [
    {
      "key": "insurance.mandatory",
      "op": "==",
      "value": true,
      "evidence": [
        {
          "source_id": "BR_DNV_LISBOA_2026",
          "locator": "Required documents list, item 4 (seguro de saude)",
          "excerpt": "Seguro de saude valido no territorio brasileiro"
        }
      ]
    },
    {
      "key": "insurance.authorized_in_brazil",
      "op": "==",
      "value": true,
      "evidence": [
        {
          "source_id": "BR_DNV_LISBOA_2026",
          "locator": "Required documents list, item 4 (seguro de saude)",
          "excerpt": "Seguro de saude valido no territorio brasileiro"
        }
      ]
    }
  ]
}
