{
  "id": "LU_STUDENT_GUICHET_2026",
  "country": "Luxembourg",
  "visa_name": "Pupil/Student Authorisation to Stay (third-country)",
  "route": "Third-country pupil authorisation to stay over 3 months (Guichet)",
  "authority": "Guichet.lu (Directorate of Immigration of Luxembourg)",
  "last_verified": "2026-06-16",
  "sources": [
    {
      "source_id": "LU_STUDENT_GUICHET_2026",
      "url": "https://guichet.public.lu/en/citoyens/immigration/plus-3-mois/ressortissant-tiers/eleve/eleve-pays-tiers.html",
      "retrieved_at": "2026-06-16T00:00:00Z",
      "sha256": "d58b4a9d4f666aa3053081f17a87ed2255323ef73ba249ef37a4d2e9059caabe",
      "local_path": "sources/LU_STUDENT_GUICHET_2026-06-16.html"
    }
  ],
  "requirements": [
    {
      "key": "insurance.mandatory",
      "op": "==",
      "value": true,
      "evidence": [
        {
          "source_id": "LU_STUDENT_GUICHET_2026",
          "locator": "Supporting documents for the temporary authorisation to stay",
          "excerpt": "a health insurance certificate (Luxembourgish or foreign) covering all risks on Luxembourg territory;"
        }
      ]
    },
    {
      "key": "insurance.authorized_in_country",
      "op": "==",
      "value": true,
      "evidence": [
        {
          "source_id": "LU_STUDENT_GUICHET_2026",
          "locator": "Supporting documents for the temporary authorisation to stay",
          "excerpt": "a health insurance certificate (Luxembourgish or foreign) covering all risks on Luxembourg territory"
        }
      ]
    },
    {
      "key": "insurance.comprehensive",
      "op": "==",
      "value": true,
      "evidence": [
        {
          "source_id": "LU_STUDENT_GUICHET_2026",
          "locator": "Supporting documents for the temporary authorisation to stay",
          "excerpt": "covering all risks on Luxembourg territory"
        }
      ]
    }
  ]
}
