{
  "id": "ME_DNV_GOVME_2026",
  "country": "Montenegro",
  "visa_name": "Digital Nomad Temporary Residence",
  "route": "Temporary residence permit for digital nomads (Government of Montenegro)",
  "authority": "Government of Montenegro (digitalnomads.gov.me)",
  "last_verified": "2026-06-15",
  "sources": [
    {
      "source_id": "ME_DNV_GOVME_2026",
      "url": "https://digitalnomads.gov.me/article/legal-status-for-nomads",
      "retrieved_at": "2026-06-15T00:00:00Z",
      "sha256": "2aa5234381d1d06bd91b43a59b5343c1b0f175609642d9223a8178681b6e5f5b",
      "local_path": "sources/ME_DNV_GOVME_2026-06-15.html"
    }
  ],
  "requirements": [
    {
      "key": "insurance.mandatory",
      "op": "==",
      "value": true,
      "evidence": [
        {
          "source_id": "ME_DNV_GOVME_2026",
          "locator": "How to get the visa, required attachments",
          "excerpt": "With the request, the foreigner is obliged to attach proof that: has financial means of support; has accommodation provided; has health insurance; has a valid foreign travel document or identity card issued to him by"
        }
      ]
    }
  ]
}
