{
  "id": "GR_DNV_MFA_2026",
  "country": "Greece",
  "visa_name": "Digital Nomad Visa",
  "route": "National Visa (Type D)",
  "authority": "Hellenic Ministry of Foreign Affairs",
  "last_verified": "2026-06-08",
  "sources": [
    {
      "source_id": "GR_WORKFROMGREECE_DNV_2026",
      "url": "https://workfromgreece.gr/setting-up-in-greece/the-digital-nomad-visa-for-greece-who-is-eligible-and-how-to-get-one/",
      "retrieved_at": "2026-06-08T00:00:00Z",
      "sha256": "4264aae1c635faa665fb3afc374c535890890ed84cbaf2517ac1831f5682d1ea",
      "local_path": "sources/GR_WORKFROMGREECE_DNV_2026-06-08.html"
    }
  ],
  "requirements": [
    {
      "key": "insurance.mandatory",
      "op": "==",
      "value": true,
      "evidence": [
        {
          "source_id": "GR_WORKFROMGREECE_DNV_2026",
          "locator": "Required documents list (Work From Greece, the portal the Hellenic MFA Digital Nomad Visa page designates for all relevant information)",
          "excerpt": "Your travel insurance"
        }
      ]
    }
  ]
}
