{
  "id": "CZ_LONGTERM_BUSINESS_IPC_2026",
  "country": "Czech Republic",
  "visa_name": "Long-term Business Visa",
  "route": "Doing Business (IPC)",
  "authority": "Ministry of the Interior of the Czech Republic (IPC)",
  "last_verified": "2026-06-10",
  "sources": [
    {
      "source_id": "CZ_IPC_INSURANCE_2026",
      "url": "https://ipc.gov.cz/en/forms-and-documents/documents/medical-insurance/",
      "retrieved_at": "2026-06-10T00:00:00Z",
      "sha256": "9ddbe03ceba165c54745267b9c3ca926e6f24a89d4af205ba79df6e6b08e7592",
      "local_path": "sources/CZ_IPC_INSURANCE_2026-06-10.html"
    }
  ],
  "requirements": [
    {
      "key": "insurance.mandatory",
      "op": "==",
      "value": true,
      "evidence": [
        {
          "source_id": "CZ_IPC_INSURANCE_2026",
          "locator": "Medical Insurance (Official Information Portal for Foreigners, ipc.gov.cz)",
          "excerpt": "The insurance coverage amount (the agreed limit per insured event) must be at least EUR 400,000, with no cost sharing by the insured person."
        }
      ]
    },
    {
      "key": "insurance.min_coverage",
      "op": ">=",
      "value": 400000,
      "currency": "EUR",
      "evidence": [
        {
          "source_id": "CZ_IPC_INSURANCE_2026",
          "locator": "Medical Insurance, coverage amount",
          "excerpt": "The insurance coverage amount (the agreed limit per insured event) must be at least EUR 400,000"
        }
      ]
    },
    {
      "key": "insurance.no_deductible",
      "op": "==",
      "value": true,
      "evidence": [
        {
          "source_id": "CZ_IPC_INSURANCE_2026",
          "locator": "Medical Insurance, coverage amount",
          "excerpt": "must be at least EUR 400,000, with no cost sharing by the insured person"
        }
      ]
    }
  ]
}
