{
  "id": "CV_STUDENTRES_DGTCV_2026",
  "country": "Cape Verde",
  "visa_name": "Residence Authorisation for Higher-Education Students",
  "route": "Residence authorisation for higher-education students (Lei n. 66/VIII/2014, art. 53)",
  "authority": "Republic of Cabo Verde (Boletim Oficial, Lei n. 66/VIII/2014)",
  "last_verified": "2026-06-16",
  "sources": [
    {
      "source_id": "CV_STUDENTRES_DGTCV_2026",
      "url": "https://dgtcv.gov.cv/index.php?Itemid=437&catid=15&id=33%3Alei-n-80-viii-2015-de-07-de-janeiro&m=0&option=com_jdownloads&task=download.send",
      "retrieved_at": "2026-06-16T00:00:00Z",
      "sha256": "7f1553a90efefae6f310d5fc9d37f31b2a1cd0b870e8fa6a783bf559919ce7de",
      "local_path": "sources/CV_STUDENTRES_DGTCV_2026-06-16.pdf"
    }
  ],
  "requirements": [
    {
      "key": "insurance.mandatory",
      "op": "==",
      "value": true,
      "evidence": [
        {
          "source_id": "CV_STUDENTRES_DGTCV_2026",
          "locator": "Artigo 53, Autorizacao de residencia para estudantes do ensino superior",
          "excerpt": "E concedida uma autorizacao de residencia ao estudante do ensino superior que: ... d) Disponha de seguro de saude."
        }
      ]
    }
  ]
}
