{
  "id": "MV_RESIDENT_IMMIG_2026",
  "country": "Maldives",
  "visa_name": "Resident Visa (spouse of a Maldivian)",
  "route": "Resident Visa, first-time applicants (Maldives Immigration)",
  "authority": "Maldives Immigration",
  "last_verified": "2026-06-16",
  "sources": [
    {
      "source_id": "MV_RESIDENT_IMMIG_2026",
      "url": "https://www.immigration.gov.mv/visa/resident",
      "retrieved_at": "2026-06-16T00:00:00Z",
      "sha256": "2acd748624934dc2feafe813ae328a3ec933cb03ce5171c2af1554fc3edcab51",
      "local_path": "sources/MV_RESIDENT_IMMIG_2026-06-16.html"
    }
  ],
  "requirements": [
    {
      "key": "insurance.mandatory",
      "op": "==",
      "value": true,
      "evidence": [
        {
          "source_id": "MV_RESIDENT_IMMIG_2026",
          "locator": "Resident Visa, required documents",
          "excerpt": "Health insurance (first-time applicants only)"
        }
      ]
    }
  ]
}
